{
  "run_id": "orb-synthetic-v1",
  "strategy": "orb",
  "label": "Synthetic fixture — hypothetical test data only",
  "dataset": {
    "kind": "synthetic",
    "source": "Seeded synthetic bars (seed 20261026); no market data",
    "start": "2026-08-06",
    "end": "2026-08-12",
    "sessions": 5
  },
  "kind": "walk_forward",
  "costs": {
    "commission_rt_usd": 1.24,
    "entry_slip_ticks": 1,
    "stop_slip_ticks": 1,
    "contract": "MNQ"
  },
  "split": {
    "in_sample": [
      "2026-08-06",
      "2026-08-10"
    ],
    "out_of_sample": [
      "2026-08-11",
      "2026-08-12"
    ]
  },
  "stats": {
    "trades": 15,
    "win_rate": 0.6,
    "avg_r": 0.105833,
    "net_r": 1.5875,
    "net_usd": 25.4,
    "max_dd_usd": 27.72,
    "profit_factor": 1.277778,
    "sharpe_daily": 3.976834,
    "months_positive": 1,
    "months": 1,
    "worst_month_usd": 25.4
  },
  "segments": {
    "by_side": {
      "short": {
        "n": 8,
        "win_rate": 0.375,
        "avg_r": -0.23375,
        "net_r": -1.87,
        "net_usd": -29.92
      },
      "long": {
        "n": 7,
        "win_rate": 0.8571428571428571,
        "avg_r": 0.493929,
        "net_r": 3.4575,
        "net_usd": 55.32
      }
    },
    "by_regime": {
      "trend": {
        "n": 9,
        "win_rate": 0.5555555555555556,
        "avg_r": -0.021944,
        "net_r": -0.1975,
        "net_usd": -3.16
      },
      "range": {
        "n": 6,
        "win_rate": 0.6666666666666666,
        "avg_r": 0.2975,
        "net_r": 1.785,
        "net_usd": 28.56
      }
    },
    "by_time": {
      "13:30": {
        "n": 5,
        "win_rate": 0.6,
        "avg_r": 0.2225,
        "net_r": 1.1125,
        "net_usd": 17.8
      },
      "14:30": {
        "n": 5,
        "win_rate": 0.8,
        "avg_r": 0.1725,
        "net_r": 0.8625,
        "net_usd": 13.8
      },
      "15:30": {
        "n": 5,
        "win_rate": 0.4,
        "avg_r": -0.0775,
        "net_r": -0.3875,
        "net_usd": -6.2
      }
    },
    "by_grade": {
      "A": {
        "n": 10,
        "win_rate": 0.7,
        "avg_r": 0.1975,
        "net_r": 1.975,
        "net_usd": 31.6
      },
      "B": {
        "n": 5,
        "win_rate": 0.4,
        "avg_r": -0.0775,
        "net_r": -0.3875,
        "net_usd": -6.2
      }
    },
    "by_exit": {
      "time": {
        "n": 1,
        "win_rate": 0,
        "avg_r": -0.3275,
        "net_r": -0.3275,
        "net_usd": -5.24
      },
      "target": {
        "n": 9,
        "win_rate": 1,
        "avg_r": 0.811389,
        "net_r": 7.3025,
        "net_usd": 116.84
      },
      "stop": {
        "n": 5,
        "win_rate": 0,
        "avg_r": -1.0775,
        "net_r": -5.3875,
        "net_usd": -86.2
      }
    },
    "by_setup": {
      "orb": {
        "n": 15,
        "win_rate": 0.6,
        "avg_r": 0.105833,
        "net_r": 1.5875,
        "net_usd": 25.4
      }
    }
  },
  "checks": {},
  "c3lab_commit": "0000000000000000000000000000000000000000",
  "params_hash": "sha256:2882da2e1c86ebece1d835a029d5594e0ae6948d7838394ce1e8aa8f4e9e229f"
}
